{
  "phase": "7.5",
  "verdict": "PASS",
  "iterations": 1,
  "compound_risk_tier": "medium",
  "compound_entry_path": "vault/compounds/pt-141.md",
  "required_fields": {
    "adverse_effects_literature": "populated",
    "contraindications": "populated",
    "monitoring": "populated",
    "stopping_criteria": "populated"
  },
  "third_party_monitoring_marker_present": true,
  "third_party_markers": [
    "blood pressure (ambulatory/clinical)",
    "resting heart rate",
    "dermatologic hyperpigmentation exam"
  ],
  "halt_reasons": [],
  "timestamp": "2026-06-21T13:34:03.415540+00:00",
  "attestation_chain": {
    "iter_start_ts": "2026-06-21T13:31:51.929950+00:00",
    "attest_ts": "2026-06-21T13:34:03.415543+00:00",
    "iteration": 1,
    "agent_source_path": "gates/gate-7.5.md",
    "agent_source_sha256": "3f0fef8924d9d17d506a3cbc4c9a5dd58ef6fc56f5c78ba0d4bc3c228d0a38da",
    "agent_source_mtime": "2026-06-21T13:33:40.365369+00:00"
  }
}