{
  "phase": "7.5",
  "compound_risk_tier": "experimental",
  "compound_entry_path": "vault/library/peptides/ipamorelin/research-report.md",
  "required_fields": {
    "adverse_effects_literature": "populated",
    "contraindications": "populated",
    "monitoring": "populated",
    "stopping_criteria": "placeholder-with-pointer"
  },
  "third_party_monitoring_marker_present": true,
  "third_party_markers": [
    "IGF-1",
    "fasting glucose",
    "HbA1c"
  ],
  "halt_reasons": [],
  "iterations": 1,
  "verdict": "PASS",
  "timestamp": "2026-06-20T17:25:09.425606+00:00",
  "attestation_chain": {
    "iter_start_ts": "2026-06-20T17:16:12.528322+00:00",
    "attest_ts": "2026-06-20T17:25:09.425609+00:00",
    "iteration": 1,
    "agent_source_path": "gates/gate-7.5.md",
    "agent_source_sha256": "d2bd12d7b06b0205eb9670901690b80a20b26b54e6c1ab2c6029b93c2b8db5a4",
    "agent_source_mtime": "2026-06-20T17:24:13.238080+00:00"
  }
}