{
  "phase": "7.5",
  "verdict": "PASS",
  "iterations": 1,
  "compound_risk_tier": "experimental",
  "compound_entry_path": "vault/compounds/humanin.md",
  "required_fields": {
    "adverse_effects_literature": "populated",
    "contraindications": "populated",
    "monitoring": "populated",
    "stopping_criteria": "populated"
  },
  "third_party_monitoring_marker_present": true,
  "third_party_markers": [
    "CBC with differential (parenteral/baseline cancer screen)",
    "relevant tumor markers (malignancy surveillance, personal-risk-based)",
    "fasting glucose / HbA1c (metabolic axis \u2014 supported by \u00a75.3 IFG biomarker data and \u00a74 metabolic sections)"
  ],
  "halt_reasons": [],
  "timestamp": "2026-06-20T22:02:17.454859+00:00",
  "attestation_chain": {
    "iter_start_ts": "2026-06-20T22:00:23.839578+00:00",
    "attest_ts": "2026-06-20T22:02:17.454862+00:00",
    "iteration": 1,
    "agent_source_path": "gates/gate-7.5.md",
    "agent_source_sha256": "a26b00eb289b17e77f5db9678f58a007beaf0e8236f69550a4d0d022c0f985e9",
    "agent_source_mtime": "2026-06-20T22:01:50.493886+00:00"
  }
}